,product_id,product_name,seller_id,seller_name,seller_product_id,primary_category_name,brand_id,brand_name,discount,discount_rate,original_price,price,rating_average,review_count,shipping_code,shipping_text,page,completion_time
90,245772068,Chuột máy tính không dây (Wireless mouse) HP Z3700 nhiều màu sắc - Hàng Chính Hãng,12854,ThuanThienTs,245772072,Chuột Văn Phòng Không Dây,17825,HP,0,0,299000,299000,5.0,1,delivery_info_badge,Giao chiều mai,2,2023-12-26 09:30:01.110845
91,213715957,Chuột không dây Rapoo M650 Lucky Cat (Wireless/Bluetooth) - Hàng chính hãng,280245,RAPOO Official Store,213715958,Chuột Văn Phòng Không Dây,20271,Rapoo,0,0,349000,349000,0.0,0,delivery_info_badge,"Giao thứ 6, 29/12",2,2023-12-26 09:30:01.110845
92,263046991,Chuột Không Dây Dell MS3320W - Hàng Chính Hãng,30787,AN PHAT COMPUTER,263046992,Chuột Văn Phòng Không Dây,18805,Dell,0,0,569000,569000,5.0,1,delivery_info_badge,"Giao thứ 6, 29/12",2,2023-12-26 09:30:01.110845
93,218751200,Chuột công thái học không dây Logitech Lift Vertical Ergonomic - Hàng Chính Hãng,34716,GiaPhucStore,218751204,Chuột Văn Phòng Không Dây,18984,Logitech,0,0,1390000,1390000,5.0,1,delivery_info_badge,Giao chiều mai,2,2023-12-26 09:30:01.110845
94,196187316,Chuột Không Dây Hình  OTO Huqu V3- Độ Phân Giải Quang Học 1200DPI- Hàng Chính Hãng,281739,Công Nghệ Điện Tử 88,196187331,Chuột Văn Phòng Không Dây,5763205,HuQu,25000,9,270000,245000,5.0,34,delivery_info_badge,"Giao thứ 6, 29/12",2,2023-12-26 09:30:01.110845
95,192167319,"Chuột Không Dây , Chuột Sạc Pin M402 có đèn",201101,TIẾN PHÁT STORE,192167323,Chuột Văn Phòng Không Dây,111461,OEM,0,0,119800,119800,4.7,3,tikinow,Giao siêu tốc 2h,2,2023-12-26 09:30:01.110845
96,135612810,Chuột không dây Genius NX-7015 hàng chính hãng,287323,SILICOM STORE,182985487,Chuột Văn Phòng Không Dây,19071,Genius,34000,15,230000,196000,0.0,0,delivery_info_badge,Giao chiều mai,2,2023-12-26 09:30:01.110845
97,36189773,Chuột Bluetooth không dây loại xịn ADGX2 kết nối qua cổng USB không dây và Bluetooth đều được 2 trong 1 - Hàng nhập khẩu,57154,Agiadep Brand,36189774,Chuột Văn Phòng Không Dây,111461,OEM,0,0,168000,168000,3.7,46,delivery_info_badge,"Giao thứ 6, 29/12",2,2023-12-26 09:30:01.110845
98,2301357,Chuột Không Dây Bosston Q1 (Đen) - Hàng Chính Hãng,53713,linhkien1984,176659175,Chuột Văn Phòng Không Dây,111393,Bosston,0,0,53000,53000,0.0,0,delivery_info_badge,Giao chiều mai,2,2023-12-26 09:30:01.110845
99,192135187,Chuột không dây kiểu đứng sạc pin T22 wireless USB 2.4GHz chống mỏi tay chuyên dùng cho pc laptop macbook ipad tivi,201101,TIẾN PHÁT STORE,192135189,Chuột Văn Phòng Không Dây,111461,OEM,32300,10,322800,290500,4.5,15,tikinow,Giao siêu tốc 2h,2,2023-12-26 09:30:01.110845
100,144803533,"Chuột không dây bluetooth Logitech POP Mouse kết nối đa thiết bị Emoji có thể tùy chỉnh, SilentTouch giảm ồn - Hàng chính hãng",27572,NGUYENVUSTORE,226961854,Chuột Văn Phòng Không Dây,18984,Logitech,0,0,590000,590000,5.0,71,delivery_info_badge,"Giao thứ 6, 29/12",3,2023-12-26 09:30:03.089036
101,23518127,Chuột Không Dây Microsoft 1850 Receiver USB - Hàng Chính Hãng,200265,Kmart Store,271312060,Chuột Văn Phòng Không Dây,19246,Microsoft,0,0,269000,269000,4.8,30,delivery_info_badge,Giao chiều mai,3,2023-12-26 09:30:03.089036
102,20225162,Chuột Không Dây Forter V8 Slient Mouse (Không tiếng ồn) Màu Xanh Dương - Hàng Chính Hãng,20367,VI TÍNH NAM TRUNG HẢI,54928909,Chuột Văn Phòng Không Dây,41528,Forter,0,0,180000,180000,4.8,44,tikinow,Giao siêu tốc 2h,3,2023-12-26 09:30:03.089036
103,273057538,"Chuột Máy Tính Bluetooth Không Dây Siêu Chip PAW3395 Attack Shark X3 Tặng Grip Tape, Cảm Biến Cao Cấp-Hàng Chính Hãng",152209,XSmart Official Store,273057540,Chuột Văn Phòng Không Dây,4691869,XSmart,0,0,819000,819000,5.0,1,delivery_info_badge,"Giao thứ 6, 29/12",3,2023-12-26 09:30:03.089036
104,168791800,Chuột không dây Logitech Signature M650 - Hàng chính hãng,162514,Long Hưng TechZone,168791802,Chuột Văn Phòng Không Dây,18984,Logitech,0,0,849000,849000,5.0,12,delivery_info_badge,"Giao thứ 6, 29/12",3,2023-12-26 09:30:03.089036
105,10090769,Chuột máy tính không dây DAREU LM115G Multi-color - Hàng Chính Hãng,59640,Extreme Zero Online,166007635,Chuột Văn Phòng Không Dây,150002,DareU,0,0,229000,229000,5.0,21,delivery_info_badge,"Giao thứ 5, 28/12",3,2023-12-26 09:30:03.089036
106,123673067,Chuột không dây Logitech Pebble M350 Wireless/Bluetooth - Hàng Chính Hãng,765,Tadavietnam,123673071,Chuột Văn Phòng Không Dây,18984,Logitech,0,0,419000,419000,4.8,12,delivery_info_badge,Giao chiều mai,3,2023-12-26 09:30:03.089036
107,247806746,Chuột Không Dây Microsoft 1850 Receiver USB - Hàng Chính Hãng,127051,TrustBuy,247806754,Chuột Văn Phòng Không Dây,19246,Microsoft,141000,36,390000,249000,5.0,4,tikinow,Giao siêu tốc 2h,3,2023-12-26 09:30:03.089036
108,116725239,"Chuột không dây Bluetooth, chuột máy tính HXSJ M107B chống ồn, DPI 1600, chế độ kép wireless usb 2.4Ghz, bluetooth chuyên dùng cho laptop, máy tính, tivi - Hàng chính hãng",4997,HXSJ Official Store,116725249,Chuột Văn Phòng Không Dây,302375,HXSJ,114000,46,249000,135000,4.5,66,tikinow,Giao siêu tốc 2h,3,2023-12-26 09:30:03.089036
109,233129,Chuột Không Dây Logitech M171 - Màu,27572,NGUYENVUSTORE,55748798,Chuột Văn Phòng Không Dây,18984,Logitech,0,0,235000,235000,4.6,183,delivery_info_badge,"Giao thứ 6, 29/12",3,2023-12-26 09:30:03.089036
110,174593802,"Chuột Không Dây PIX-LINK P103A Pin Sạc USB 2.4GHz DPI 1600, Không Tiếng Ồn Sử Dụng Cho PC, Laptop, Tivi Hàng Chính Hãng",278788,Pixlink Office Store,174593812,Chuột Văn Phòng Không Dây,199239,PIX-LINK,157000,54,289000,132000,5.0,16,tikinow,Giao siêu tốc 2h,3,2023-12-26 09:30:03.089036
111,56589861,"Chuột Bluetooth, Chuột Không Dây HXSJ T23, Chuột Không Dây Bluetooth T23 - Hàng chính hãng",4997,HXSJ Official Store,56589865,Chuột Văn Phòng Không Dây,302375,HXSJ,0,0,333000,333000,4.6,72,delivery_info_badge,"Giao thứ 5, 28/12",3,2023-12-26 09:30:03.089036
112,192161550,"Chuột không dây bluetooth pin sạc INPHIC PM6 có đèn báo pin, SILENT chống ồn bấm cực êm - Chuột Bluetooth cho máy tính - Hàng chính hãng",246505,PH shopp,192161565,Chuột Văn Phòng Không Dây,703139,Inphic,71000,28,250000,179000,5.0,5,delivery_info_badge,Giao chiều mai,3,2023-12-26 09:30:03.089036
113,157160524,Chuột Không Dây Wireless ZADEZ M331 - Hàng Chính Hãng,127051,TrustBuy,157160528,Chuột Văn Phòng Không Dây,5175045,ZADEZ,71000,37,190000,119000,5.0,4,tikinow,Giao siêu tốc 2h,3,2023-12-26 09:30:03.089036
114,45842739,Chuột không dây sạc điện cao cấp,32204,Android tv box Bright star,217726814,Chuột Văn Phòng Không Dây,633653,JiTuo,0,0,59000,59000,0.0,0,delivery_info_badge,"Giao thứ 7, 30/12",3,2023-12-26 09:30:03.089036
115,185940276,Chuột công thái học không dây Logitech Lift Vertical Ergonomic Đen-Hàng Chính Hãng ,60386,VNB STORE,185940277,Chuột Văn Phòng Không Dây,18984,Logitech,0,0,1290000,1290000,5.0,3,delivery_info_badge,"Giao thứ 6, 29/12",3,2023-12-26 09:30:03.089036
116,74409316,"Chuột không dây Bluetooth, chuột không dây usb 2.4Hz HXSJ T18 - Hàng chính hãng",4997,HXSJ Official Store,74409318,Chuột Văn Phòng Không Dây,302375,HXSJ,234000,67,349000,115000,4.7,159,delivery_info_badge,"Giao thứ 5, 28/12",3,2023-12-26 09:30:03.089036
117,144973012,Chuột không dây Bluetooth 5.0 Dareu LM115B + Wireless 2.4GHz ( Silent Switch ) - Hàng chính hãng,65781,Máy Tính Bảo Minh,202659163,Chuột Văn Phòng Không Dây,150002,DareU,0,0,245000,245000,4.8,27,delivery_info_badge,"Giao thứ 6, 29/12",3,2023-12-26 09:30:03.089036
118,173425401,Chuột không dây Logitech M650 Hàng Chính Hãng,34716,GiaPhucStore,173425403,Chuột Văn Phòng Không Dây,18984,Logitech,0,0,635000,635000,5.0,2,delivery_info_badge,Giao chiều mai,3,2023-12-26 09:30:03.089036
119,249950110,Chuột Led Không Dây M303 Đa kết nối Bluetooth chống ồn,110920,Timy,249950112,Chuột Văn Phòng Không Dây,111461,OEM,0,0,255000,255000,0.0,0,delivery_info_badge,Giao chiều mai,3,2023-12-26 09:30:03.089036
120,139307448,CHUỘT KHÔNG DÂY Dareu LM115G Wireless Black- Mouse_ HÀNG CHÍNH HÃNG,65781,Máy Tính Bảo Minh,157977991,Chuột Văn Phòng Không Dây,150002,DareU,0,0,125000,125000,4.8,6,delivery_info_badge,"Giao thứ 6, 29/12",3,2023-12-26 09:30:03.089036
121,72010730,CHUỘT MÁY TÍNH KHÔNG DÂY CHỐNG ỒN BT21 BABY BEENS MOUSE,140682,Beens International,72010738,Chuột Văn Phòng Không Dây,32745,Royche,0,0,330000,330000,5.0,53,delivery_info_badge,Giao chiều mai,3,2023-12-26 09:30:03.089036
122,263385542,Chuột Không Dây trong suốt T900 Bluetooth 5.0 / 3.0 / USB 2.4G - chống ồn - Pin sạc TypeC - kết nối đa thiết bị,58789,Tech7,263385552,Chuột Văn Phòng Không Dây,111461,OEM,0,0,265000,265000,5.0,3,delivery_info_badge,Giao chiều mai,3,2023-12-26 09:30:03.089036
123,75032335,CHUỘT KHÔNG DÂY CHỐNG ỒN NHÂN VẬT HOẠT HÌNH PEANUTS SNOOPY (CÓ THỂ KẾT NỐI BLUETOOTH) HÀNG CHÍNH HÃNG,140682,Beens International,75032343,Chuột Văn Phòng Không Dây,32745,Royche,0,0,429000,429000,4.8,15,delivery_info_badge,Giao chiều mai,3,2023-12-26 09:30:03.089036
124,86297289,"Chuột không dây tự sạc  (Wireless/Bluetooth Mouse Re-chargeable) chuyên dùng cho Máy tính, Laptop, Phone, Tivi",174379,Hùng Dũng 68,86297311,Chuột Văn Phòng Không Dây,111461,OEM,0,0,119000,119000,4.6,43,delivery_info_badge,"Giao thứ 6, 29/12",3,2023-12-26 09:30:03.089036
125,170499194,Chuột không dây Logitech Signature M650L màu đen- Hàng chính hãng,60386,VNB STORE,206862595,Chuột Văn Phòng Không Dây,18984,Logitech,0,0,589000,589000,5.0,2,delivery_info_badge,"Giao thứ 6, 29/12",3,2023-12-26 09:30:03.089036
126,72723335,Chuột không dây Logitech M190 - Hàng Chính Hãng,765,Tadavietnam,108358346,Chuột Văn Phòng Không Dây,18984,Logitech,0,0,279000,279000,5.0,18,delivery_info_badge,"Giao thứ 5, 28/12",3,2023-12-26 09:30:03.089036
127,155031998,Chuột Không Dây M331 Silent Plus Giao Màu Ngẫu Nhiên,117842,Hưng Thịnh HN,176037760,Chuột Văn Phòng Không Dây,111461,OEM,0,0,284999,284999,4.6,11,delivery_info_badge,"Giao thứ 6, 29/12",3,2023-12-26 09:30:03.089036
128,691576,Chuột Không Dây Logitech M720 Triathlon - Hàng Chính Hãng,333,Trọng Ân audio,975492,Chuột Văn Phòng Không Dây,18984,Logitech,0,0,924000,924000,4.5,30,delivery_info_badge,Giao chiều mai,3,2023-12-26 09:30:03.089036
129,691568,"Chuột không dây Logitech B170 - đầu thu USB 2.4Ghz, pin 1 năm, nhỏ gọn, thiết kế thuận cả 2 tay, phù hợp PC/ Laptop - Hàng chính hãng",356,TAVASA,14643838,Chuột Văn Phòng Không Dây,18984,Logitech,0,0,189000,189000,4.5,17,delivery_info_badge,Giao chiều mai,3,2023-12-26 09:30:03.089036
130,87054957,Chuột không dây Bluetooth Và 2.4G Pin Sạc,53713,linhkien1984,189840227,Chuột Văn Phòng Không Dây,111461,OEM,0,0,68900,68900,5.0,8,delivery_info_badge,Giao chiều mai,3,2023-12-26 09:30:03.089036
131,245772068,Chuột máy tính không dây (Wireless mouse) HP Z3700 nhiều màu sắc - Hàng Chính Hãng,12854,ThuanThienTs,245772072,Chuột Văn Phòng Không Dây,17825,HP,0,0,299000,299000,5.0,1,delivery_info_badge,Giao chiều mai,3,2023-12-26 09:30:03.089036
132,58340599,Chuột không dây bluetooth Microsoft Modern Mobile - Hàng Chính Hãng,200265,Kmart Store,139496991,Chuột Văn Phòng Không Dây,19246,Microsoft,0,0,590000,590000,4.8,9,delivery_info_badge,Giao chiều mai,3,2023-12-26 09:30:03.089036
133,262980513,Chuột không dây HyperWork Silentium MS01 - Hàng Chính Hãng,60386,VNB STORE,262980516,Chuột Văn Phòng Không Dây,5073869,HyperWork,0,0,490000,490000,5.0,1,delivery_info_badge,"Giao thứ 6, 29/12",3,2023-12-26 09:30:03.089036
134,160305888,Chuột không dây Logitech M331 - Hàng chính hãng,162514,Long Hưng TechZone,160305890,Chuột Văn Phòng Không Dây,18984,Logitech,120000,26,469000,349000,4.8,23,delivery_info_badge,"Giao thứ 6, 29/12",3,2023-12-26 09:30:03.089036
135,31123691,Chuột Không Dây Ghost Wolf G829 - Pin sạc cổng micro USB Hàng nhập khẩu,201101,TIẾN PHÁT STORE,132840228,Chuột Văn Phòng Không Dây,523563,Ghost Wolf,0,0,205900,205900,5.0,9,tikinow,Giao siêu tốc 2h,3,2023-12-26 09:30:03.089036
136,260813303,Chuột không dây Bluetooth Logitech M240 Silent - Hàng chính hãng,34716,GiaPhucStore,263596480,Chuột Văn Phòng Không Dây,18984,Logitech,0,0,345000,345000,0.0,0,delivery_info_badge,Giao chiều mai,3,2023-12-26 09:30:03.089036
137,263354473,Chuột không dây Logitech M240 Silent Bluetooth - Hàng chính hãng,333,Trọng Ân audio,272040286,Chuột Văn Phòng Không Dây,18984,Logitech,0,0,379000,379000,2.0,1,delivery_info_badge,Giao chiều mai,3,2023-12-26 09:30:03.089036
138,196603129,Chuột Bluetooth FD V8 - JL -HÀNG CHÍNH HÃNG,64160,Công Nghệ July,196603130,Chuột Văn Phòng Không Dây,410617,FD,0,0,175000,175000,0.0,0,delivery_info_badge,Giao chiều mai,3,2023-12-26 09:30:03.089036
139,56606433,Chuột Không Dây Sạc Điện HXSJ M80 - Hàng chính hãng,4997,HXSJ Official Store,56606435,Chuột Văn Phòng Không Dây,302375,HXSJ,54000,43,126000,72000,4.5,102,tikinow,Giao siêu tốc 2h,3,2023-12-26 09:30:03.089036
140,19359126,Chuột Không Dây Dell WM126 - Hàng Chính Hãng,915,Nova Computer,188837772,Chuột Văn Phòng Không Dây,18805,Dell,9900,4,268900,259000,4.6,11,delivery_info_badge,Giao chiều mai,4,2023-12-26 09:30:04.926434
141,191354473,Chuột Không Dây Mô Hình Ôtô Huqu V2-Kết Nối USB  2.4GHz -Hàng Chính Hãng,281739,Công Nghệ Điện Tử 88,191354485,Chuột Văn Phòng Không Dây,5763205,HuQu,21000,9,230000,209000,5.0,37,delivery_info_badge,"Giao thứ 6, 29/12",4,2023-12-26 09:30:04.926434
142,130730910,"Chuột Không Dây A2 Pro, Chuột Máy Tính Không Tạo Tiếng Ồn, Sạc Được Pin, Hiệu Ứng Đèn Led RGB",53713,linhkien1984,189979814,Chuột Văn Phòng Không Dây,111461,OEM,0,0,59000,59000,4.0,3,delivery_info_badge,Giao chiều mai,4,2023-12-26 09:30:04.926434
143,177999059,Chuột không dây Logitech Pebble M350 - Hàng chính hãng,162514,Long Hưng TechZone,177999061,Chuột Văn Phòng Không Dây,18984,Logitech,171000,24,700000,529000,0.0,0,delivery_info_badge,"Giao thứ 6, 29/12",4,2023-12-26 09:30:04.926434
144,253264605,"Chuột không dây Logitech B175 - đầu thu USB 2.4Ghz, pin 1 năm, nhỏ gọn, thiết kế thuận cả 2 tay, phù hợp PC/Laptop - Hàng chính hãng",52525,An Khang Computer,253264606,Chuột Văn Phòng Không Dây,18984,Logitech,31000,16,190000,159000,5.0,1,delivery_info_badge,"Giao thứ 6, 29/12",4,2023-12-26 09:30:04.926434
145,203897752,Chuột Bluetooth A2 Trắng,309961,GAGROUP,203897753,Chuột Văn Phòng Không Dây,111461,OEM,0,0,75000,75000,0.0,0,delivery_info_badge,Giao chiều mai,4,2023-12-26 09:30:04.926434
146,199706098,"Chuột không dây PROLiNK PMW6009 độ nhạy cao, tiết kiệm pin dành cho PC, Macbook, Laptop - Hàng chính hãng",145378,Prolink Official Store,199706101,Chuột Văn Phòng Không Dây,33036,Prolink,50000,25,199000,149000,4.7,66,delivery_info_badge,Giao chiều mai,4,2023-12-26 09:30:04.926434
147,54972170,Chuột Không Dây A2 Chống Ồn Pin Sạc Được Không Cần Thay PIN - Màu Ngẫu Nhiên,76796,Vietstore24h,190229412,Chuột Văn Phòng Không Dây,111461,OEM,17000,25,69000,52000,5.0,5,delivery_info_badge,Giao chiều mai,4,2023-12-26 09:30:04.926434
148,140523443,"Chuột Bluetooth Dareu LM115B Pink (Màu Hồng) - Kết Nối Điện Thoại, iPad, Macbook - Hàng Chính Hãng",27572,NGUYENVUSTORE,142234176,Chuột Văn Phòng Không Dây,150002,DareU,0,0,265000,265000,4.8,43,delivery_info_badge,"Giao thứ 6, 29/12",4,2023-12-26 09:30:04.926434
149,183526240,Chuột không dây Fuhlen A09B Hồng (pink) - Hàng chính hãng,65781,Máy Tính Bảo Minh,188579572,Chuột Văn Phòng Không Dây,19107,Fuhlen,0,0,138000,138000,0.0,0,delivery_info_badge,"Giao thứ 6, 29/12",4,2023-12-26 09:30:04.926434
150,56669854,Chuột Bluetooth HXSJ T36 Ba Chế Độ Bluetooth 3.0 + 5.0 + 2.4G Chuột Không Dây Thiết Kế Không Gây Ồn 1600 DPI Quang Có Thể Sạc Lại Chuột Cho PC Máy Tính Xách Tay - Hàng chính hãng,4997,HXSJ Official Store,56669855,Chuột Văn Phòng Không Dây,302375,HXSJ,165000,47,349000,184000,4.5,62,delivery_info_badge,"Giao thứ 5, 28/12",4,2023-12-26 09:30:04.926434
151,26165963,Chuột Không Dây Dareu LM115G Có LED Tem Mai Hoàng - Hàng Nhập Khẩu,59640,Extreme Zero Online,271120342,Chuột Văn Phòng Không Dây,150002,DareU,0,0,139000,139000,0.0,0,delivery_info_badge,"Giao thứ 5, 28/12",4,2023-12-26 09:30:04.926434
152,56033,Chuột Không Dây Logitech M187,333,Trọng Ân audio,255223213,Chuột Văn Phòng Không Dây,18984,Logitech,0,0,277000,277000,5.0,2,delivery_info_badge,Giao chiều mai,4,2023-12-26 09:30:04.926434
153,92926828,Chuột Không Dây Màu Hồng / Đen/ Xám/ Xanh ngọc Forter V182 V6,65781,Máy Tính Bảo Minh,103278702,Chuột Văn Phòng Không Dây,111461,OEM,0,0,85000,85000,5.0,7,delivery_info_badge,"Giao thứ 6, 29/12",4,2023-12-26 09:30:04.926434
154,23362701,Chuột Không Dây Forter V181 - Hàng nhập khẩu,9786,Kiwivision,39993144,Chuột Văn Phòng Không Dây,41528,Forter,0,0,39000,39000,4.3,48,delivery_info_badge,"Giao thứ 6, 29/12",4,2023-12-26 09:30:04.926434
155,194462575,Chuột led gaming không dây X11 -  Bluetooth + Usb Wireless 2.4G - Pin sạc cổng typeC - Chống ồn - chống mỏi cổ tay - Hàng nhập khẩu,58789,Tech7,194462576,Chuột Văn Phòng Không Dây,7488505,X11,0,0,255000,255000,5.0,2,delivery_info_badge,Giao chiều mai,4,2023-12-26 09:30:04.926434
156,186147077,Chuột Không Dây Logitech M325s - Hàng Chính Hãng,200265,Kmart Store,186147079,Chuột Văn Phòng Không Dây,18984,Logitech,0,0,375000,375000,0.0,0,delivery_info_badge,Giao chiều mai,4,2023-12-26 09:30:04.926434
157,7626419,Chuột không dây Fuhlen M70 - Hãng phân phối chính thức,4106,CÔNG NGHỆ TẦM NHÌN,116409238,Chuột Văn Phòng Không Dây,19107,Fuhlen,0,0,125000,125000,4.0,1,delivery_info_badge,"Giao thứ 6, 29/12",4,2023-12-26 09:30:04.926434
158,28794512,Chuột không dây sạc điện tặng lót chuột,20367,VI TÍNH NAM TRUNG HẢI,194562596,Chuột Văn Phòng Không Dây,111461,OEM,0,0,65055,65055,4.0,2,delivery_info_badge,Giao chiều mai,4,2023-12-26 09:30:04.926434
159,215223928,Chuột không dây Rapoo M21 Silent màu đen- Hàng chính hãng,27572,NGUYENVUSTORE,262970927,Chuột Văn Phòng Không Dây,20271,Rapoo,27000,19,139000,112000,5.0,1,tikinow,Giao siêu tốc 2h,4,2023-12-26 09:30:04.926434
160,24989529,Chuột quang không dây Fuhlen A09 - Hàng Nhập Khẩu,65781,Máy Tính Bảo Minh,25960689,Chuột Văn Phòng Không Dây,19107,Fuhlen,0,0,144000,144000,0.0,0,delivery_info_badge,"Giao thứ 6, 29/12",4,2023-12-26 09:30:04.926434
161,178031117,Chuột Không Dây Bluetooth 5.0 Chống ồn T67 siêu nhẹ - hàng nhập khẩu,58789,Tech7,178031118,Chuột Văn Phòng Không Dây,302375,HXSJ,0,0,175000,175000,3.0,2,delivery_info_badge,Giao chiều mai,4,2023-12-26 09:30:04.926434
162,101280008,Chuột Văn Phòng Không Dây Cao Cấp IMICE G-1600 Silent Giảm Ồn 90% Bộ Thu Nano Tự Động Kết Nối  Hoạt Động Chính Xác Mượt Mà Khoảng Cách 10m Tiết Kiệm Pin Thông Minh Thay Đổi Nhanh  Độ Phân Giải 800/1200/1600DPI - Hàng Chính Hãng,201101,TIẾN PHÁT STORE,132840662,Chuột Văn Phòng Không Dây,192495,Imice,15700,10,157000,141300,5.0,3,tikinow,Giao siêu tốc 2h,4,2023-12-26 09:30:04.926434
163,250015553,"Chuột Không Dây FORDER i330H Không Ồn, Họa Tiết Độc Đáo - Hàng Chính Hãng",12591,Nguyễn Ninh Media,250015555,Chuột Văn Phòng Không Dây,279189,Forder,0,0,199000,199000,1.0,1,delivery_info_badge,"Giao thứ 6, 29/12",4,2023-12-26 09:30:04.926434
164,116192774,"Chuột không dây bluetooth PIXLINK M100B chống ồn, DPI 1600  sạc pin - Hàng chính hãng",197029,PixLink Technology,116192784,Chuột Văn Phòng Không Dây,199239,PIX-LINK,0,0,289000,289000,4.3,32,delivery_info_badge,"Giao thứ 6, 29/12",4,2023-12-26 09:30:04.926434
165,187827496,Chuột không dây Asus - Hàng Chính hãng,12854,ThuanThienTs,187827497,Chuột Văn Phòng Không Dây,17826,Asus,0,0,1000000,1000000,0.0,0,delivery_info_badge,Giao chiều mai,4,2023-12-26 09:30:04.926434
166,249744510,Chuột không dây Xiaomi Mi Dual Mode Silent Edition - Hàng chính hãng,122357,Xiaomi Official Stores,217261037,Chuột Văn Phòng Không Dây,25422,Xiaomi,0,0,390000,390000,5.0,3,delivery_info_badge,Giao chiều mai,4,2023-12-26 09:30:04.926434
167,4486983,Chuột Không Dây Rapoo M10 Plus 1000 DPI Receiver USB,280245,RAPOO Official Store,174859805,Chuột Văn Phòng Không Dây,20271,Rapoo,0,0,135000,135000,0.0,0,tikinow,Giao siêu tốc 2h,4,2023-12-26 09:30:04.926434
168,262652958,Chuột không dây 2.4Ghz & Bluetooth A4TECH FB35C (Pin sạc tiện lợi) - Hàng Chính Hãng,45223,Bảo Hân Treasures,262652960,Chuột Văn Phòng Không Dây,48051,A4Tech,15000,5,330000,315000,0.0,0,delivery_info_badge,Giao chiều mai,4,2023-12-26 09:30:04.926434
169,143963189,Chuột không dây pin sạc Genius ECO 8100 - Hàng chính hãng,218999,SingPC Official Store,143963191,Chuột Văn Phòng Không Dây,19071,Genius,49500,15,330000,280500,5.0,4,delivery_info_badge,Giao chiều mai,4,2023-12-26 09:30:04.926434
170,133138709,Chuột không dây Dareu LM115G - Hàng chính hãng,59640,Extreme Zero Online,271120424,Chuột Văn Phòng Không Dây,150002,DareU,0,0,139000,139000,0.0,0,delivery_info_badge,"Giao thứ 5, 28/12",4,2023-12-26 09:30:04.926434
171,198204537,Chuột không dây Rapoo M650 phiên bản World Cup - Kết nối đa thiết bị - Hàng chính hãng,280245,RAPOO Official Store,198204541,Chuột Văn Phòng Không Dây,20271,Rapoo,0,0,290000,290000,5.0,3,delivery_info_badge,"Giao thứ 6, 29/12",4,2023-12-26 09:30:04.926434
172,188715977,Chuột không dây INPHIC DR01 sử dụng pin sạc thiết kế hiện đại với độ DPI lên đến 1600 có đèn led báo hiệu dung lượng pin - Hàng Nhập Khẩu - NTH,20367,VI TÍNH NAM TRUNG HẢI,188715978,Chuột Văn Phòng Không Dây,703139,Inphic,0,0,190000,190000,5.0,1,delivery_info_badge,Giao chiều mai,4,2023-12-26 09:30:04.926434
173,72308542,"Chuột không dây PROLiNK PMB8502 cao cấp, tiết kiệm pin , chơi game, văn phòng dùng cho PC, Macbook, Laptop",145378,Prolink Official Store,199728678,Chuột Văn Phòng Không Dây,33036,Prolink,110000,28,399000,289000,4.5,100,delivery_info_badge,Giao chiều mai,4,2023-12-26 09:30:04.926434
174,104496077,"Chuột không dây PROLiNK PMW5010 kết nối tốc độ cao, tiết kiệm pin dùng cho PC, Macbook, Laptop - Hàng chính hãng",145378,Prolink Official Store,104496081,Chuột Văn Phòng Không Dây,33036,Prolink,41000,22,190000,149000,4.6,105,delivery_info_badge,Giao chiều mai,4,2023-12-26 09:30:04.926434
175,205031999,"Chuột không dây Logitech M185 - đầu thu USB 2.4Ghz, pin 1 năm, 1000 DPI, thiết kế thuận cả 2 tay, phù hợp PC/ Laptop - Hàng chính hãng",1377,Vi Tính Bảo An,205032005,Chuột Văn Phòng Không Dây,18984,Logitech,0,0,220000,220000,0.0,0,delivery_info_badge,Giao chiều mai,4,2023-12-26 09:30:04.926434
176,176842780,Chuột Bluetooth Rapoo M200 Silent - Hàng Chính Hãng,200265,Kmart Store,176842786,Chuột Văn Phòng Không Dây,20271,Rapoo,0,0,225000,225000,0.0,0,delivery_info_badge,Giao chiều mai,4,2023-12-26 09:30:04.926434
177,194477152,"Chuột Không Dây Pin Sạc , Wireless và Bluetooth- VT",76796,Vietstore24h,194477158,Chuột Văn Phòng Không Dây,111461,OEM,0,0,67000,67000,0.0,0,delivery_info_badge,Giao chiều mai,4,2023-12-26 09:30:04.926434
178,2883885,Chuột Không Dây Bosston Q1 1000DPI - Hàng Chính Hãng,20367,VI TÍNH NAM TRUNG HẢI,52759907,Chuột Văn Phòng Không Dây,111393,Bosston,0,0,45010,45010,4.7,3,delivery_info_badge,Giao chiều mai,4,2023-12-26 09:30:04.926434
179,21148086,Chuột Không Dây Fuhlen A09B - Tặng Lót Di Chuột - Hàng Chính Hãng,65781,Máy Tính Bảo Minh,44010149,Chuột Văn Phòng Không Dây,19107,Fuhlen,0,0,137000,137000,4.0,2,delivery_info_badge,"Giao thứ 6, 29/12",4,2023-12-26 09:30:04.926434
180,207733694,Chuột không dây A4Tech FStyler FG30S Silent Wireless 2.4GHz - Hàng chính hãng,8948,A4Tech Official Store,207733706,Chuột Văn Phòng Không Dây,48051,A4Tech,0,0,250000,250000,5.0,2,delivery_info_badge,Giao chiều mai,5,2023-12-26 09:30:06.811931
181,145977610,Chuột không dây Eblue EMS816 (USB-Wireless) - hàng chính hãng,167560,Việt Hưng VHC,145977611,Chuột Văn Phòng Không Dây,80019,Eblue,0,0,74000,74000,5.0,1,delivery_info_badge,"Giao thứ 6, 29/12",5,2023-12-26 09:30:06.811931
182,262969550,Chuột văn phòng không dây Rapoo M20 - Hàng Chính Hãng,27572,NGUYENVUSTORE,262957893,Chuột Văn Phòng Không Dây,20271,Rapoo,27000,19,139000,112000,5.0,1,tikinow,Giao siêu tốc 2h,5,2023-12-26 09:30:06.811931
183,249477757,Chuột bluetooth PROLINK PMB8502 BLK - Hàng Chính Hãng,6975,HACHI STORE,249477758,Chuột Văn Phòng Không Dây,33036,Prolink,45000,14,320000,275000,0.0,0,delivery_info_badge,"Giao thứ 5, 28/12",5,2023-12-26 09:30:06.811931
